00:37:42.769986 IP6 fe80::c9b7:b5ee:c0f:8fa7.51617 > ff02::c.1900: UDP, length 146
00:37:42.770978 IP ubuntu.local.16039 > 192.168.43.2.domain: 41525+ PTR? c.0.0.0.0.0.0.0.0.0.0.0.0.0.0.0.0.0.0.0.0.0.0.0.0.0.0.0.2.0.f.f.ip6.arpa. (90)
00:37:42.830053 IP 192.168.43.2.domain > ubuntu.local.16039: 41525- 0/6/0 (198)
00:37:42.830725 IP ubuntu.local.62186 > 192.168.43.2.domain: 59249+ PTR? 7.a.f.8.f.0.c.0.e.e.5.b.7.b.9.c.0.0.0.0.0.0.0.0.0.0.0.0.0.8.e.f.ip6.arpa. (90)
00:37:42.876994 IP 192.168.43.2.domain > ubuntu.local.62186: 59249- 0/6/0 (198)
00:37:42.877516 IP ubuntu.local.59841 > 192.168.43.2.domain: 37331+ PTR? 2.43.168.192.in-addr.arpa. (43)
00:37:42.937094 IP 192.168.43.2.domain > ubuntu.local.59841: 37331- 0/2/2 (135)
00:37:43.071038 IP6 fe80::20c:29ff:fe92:1c46.mdns > ff02::fb.mdns: 0 PTR (QM)? 2.43.168.192.in-addr.arpa. (43)
00:37:43.071360 IP ubuntu.local.mdns > 224.0.0.251.mdns: 0 PTR (QM)? 2.43.168.192.in-addr.arpa. (43)
00:37:44.055868 IP6 fe80::20c:29ff:fe92:1c46.mdns > ff02::fb.mdns: 0 PTR (QM)? 2.43.168.192.in-addr.arpa. (43)
00:37:44.056077 IP ubuntu.local.mdns > 224.0.0.251.mdns: 0 PTR (QM)? 2.43.168.192.in-addr.arpa. (43)
00:37:45.770073 IP6 fe80::c9b7:b5ee:c0f:8fa7.51617 > ff02::c.1900: UDP, length 146
00:37:46.057845 IP6 fe80::20c:29ff:fe92:1c46.mdns > ff02::fb.mdns: 0 PTR (QM)? 2.43.168.192.in-addr.arpa. (43)
00:37:46.058042 IP ubuntu.local.mdns > 224.0.0.251.mdns: 0 PTR (QM)? 2.43.168.192.in-addr.arpa. (43)
00:37:47.191777 IP ubuntu.local.59797 > 174.76.228.32.https: Flags [F.], seq 742903178, ack 595948530, win 40880, length 0

